{
  "schema_version": "0.0.1",
  "profile": "dev",
  "rustc": "rustc 1.95.0 (59807616e 2026-04-14)",
  "cargo": "cargo 1.95.0 (f2d3ce0bd 2026-03-21)",
  "llvm_version": "22.1.2",
  "cargo_lock_hash": "e79e0a2a45fd7d81fd798e03f41f1b696864469445a53159128c7adcea846ba5",
  "rust_toolchain_toml": "[toolchain]\nchannel = \"1.95\"\n",
  "target_triple": "aarch64-apple-darwin",
  "features": [],
  "locked_graph_hash": null,
  "command_recipe_hash": "4f53cda18c2baa0c0354bb5f9a3ecbe5ed12ab4d8e11ba873c2f11161202b945",
  "inputs_hash": "0e41d97284e23929807aef1e5041030acfd2bcafcca57ee711363a7958cec123",
  "resolution_policy": "locked_offline",
  "git_sha": "287503f658c9c1305b54d78ecfa7c4cc6f1490fa",
  "git_branch": "agent/144-diff-completeness",
  "git_dirty": true
}